<comidas xmlns:xsi="http://www.w3.org/2001/XMLSchema-instance"
    xsi:noNamespaceSchemaLocation="comidas.xsd">

  <comida>
    <nome>Carbonara</nome>
    <calorias>98</calorias>
    <preco>7€</preco>
  </comida>

  <comida>
    <nome>Pizza Romana</nome>
    <calorias>298</calorias>
    <preco>10€</preco>
  </comida>

  <comida>
    <nome>Supplì</nome>
    <calorias>229</calorias>
    <preco>1,50€</preco>
  </comida>

  <comida>
    <nome>Cacio e Pepe</nome>
    <calorias>211</calorias>
    <preco>5€</preco>
  </comida>

</comidas>